{
  "schema_version": "member3-plan/1.0",
  "generated_at_utc": "2026-10-29T07:03:38+00:00",
  "status_labels": {
    "inventory": "VERIFIED on SYNTHETIC demo configs",
    "risk_score": "PROVISIONAL, UNVALIDATED",
    "schedule": "VERIFIED (deterministic exact search; constraints are ASSUMPTIONS)",
    "gates": "VERIFIED loopback evidence; Generic loopback lab evidence (OpenSSL 3.5 s_server/s_client, test keys). It does NOT exercise the service's own stack (e.g. KMS key wrapping, JWT libraries, partner peers); READY means 'eligible for human review', not 'verified in production'.",
    "approval": "human-only"
  },
  "target": "demo_bank_app/configs",
  "findings": [
    {
      "finding_id": "YML-auth_gateway_tls-01",
      "service_id": "auth_gateway",
      "file_path": "demo_bank_app/configs/auth_gateway_tls.yaml",
      "line_number": 11,
      "legacy_algorithm": "RSA-2048",
      "quantum_threat": "Shor-CRQC (Integer factorization broken by cryptanalytically relevant quantum computer)",
      "target_pqc_algorithm": "ML-DSA-65 + RSA-2048 Hybrid Signature",
      "nist_standard": "FIPS 204 (ML-DSA)",
      "severity": "CRITICAL",
      "evidence_type": "config_file",
      "operation_purpose": "digital_signature",
      "confidence": "high",
      "rationale": "YAML directive 'oauth_jwt.signing_algorithm: RS256' at line 11 (sha256:85ad91f7a73221ec).",
      "owner": "Identity & Access Team",
      "library_or_protocol": "yaml:oauth_jwt.signing_algorithm=RS256",
      "human_review_status": "requires_human_review",
      "detector": "legacy",
      "algorithm_family": "RSA-2048",
      "detected_value": "",
      "location": "",
      "snippet_redacted": "",
      "ambiguity": "none",
      "in_test_file": false
    },
    {
      "finding_id": "YML-auth_gateway_tls-02",
      "service_id": "auth_gateway",
      "file_path": "demo_bank_app/configs/auth_gateway_tls.yaml",
      "line_number": 13,
      "legacy_algorithm": "SHA-1",
      "quantum_threat": "Classical collision broken + Grover preimage reduction",
      "target_pqc_algorithm": "SHA3-256 / SHA-384",
      "nist_standard": "FIPS 202 (SHA-3)",
      "severity": "HIGH",
      "evidence_type": "config_file",
      "operation_purpose": "message_digest",
      "confidence": "high",
      "rationale": "YAML directive 'oauth_jwt.thumbprint_digest: hashlib.sha1' at line 13 (sha256:85ad91f7a73221ec).",
      "owner": "Identity & Access Team",
      "library_or_protocol": "yaml:oauth_jwt.thumbprint_digest=hashlib.sha1",
      "human_review_status": "requires_human_review",
      "detector": "legacy",
      "algorithm_family": "SHA-1",
      "detected_value": "",
      "location": "",
      "snippet_redacted": "",
      "ambiguity": "none",
      "in_test_file": false
    },
    {
      "finding_id": "YML-auth_gateway_tls-03",
      "service_id": "auth_gateway",
      "file_path": "demo_bank_app/configs/auth_gateway_tls.yaml",
      "line_number": 17,
      "legacy_algorithm": "ECDHE-P256",
      "quantum_threat": "Shor-CRQC (Harvest-Now-Decrypt-Later ephemeral key exchange risk)",
      "target_pqc_algorithm": "X25519MLKEM768 Hybrid Key Establishment",
      "nist_standard": "FIPS 203 (ML-KEM)",
      "severity": "CRITICAL",
      "evidence_type": "config_file",
      "operation_purpose": "key_establishment",
      "confidence": "high",
      "rationale": "YAML directive 'tls_listener.key_exchange_curve: ECDHE-P256' at line 17 (sha256:85ad91f7a73221ec).",
      "owner": "Identity & Access Team",
      "library_or_protocol": "yaml:tls_listener.key_exchange_curve=ECDHE-P256",
      "human_review_status": "requires_human_review",
      "detector": "legacy",
      "algorithm_family": "ECDHE-P256",
      "detected_value": "",
      "location": "",
      "snippet_redacted": "",
      "ambiguity": "none",
      "in_test_file": false
    }
  ],
  "services": {
    "auth_gateway": {
      "service_id": "auth_gateway",
      "evidence_source": "OBSERVED",
      "finding_ids": [
        "YML-auth_gateway_tls-01",
        "YML-auth_gateway_tls-02",
        "YML-auth_gateway_tls-03"
      ],
      "hold_finding_ids": [],
      "files": [
        "demo_bank_app/configs/auth_gateway_tls.yaml"
      ],
      "legacy_algorithms": [
        "ECDHE-P256",
        "RSA-2048",
        "SHA-1"
      ],
      "candidate_targets": [
        "ML-DSA-65 + RSA-2048 Hybrid Signature [digital_signature]",
        "SHA3-256 / SHA-384 [message_digest]",
        "X25519MLKEM768 Hybrid Key Establishment [key_establishment]"
      ],
      "duration_minutes": 35,
      "rollout_cost": 18.0,
      "criticality": "HIGH",
      "verification_ready_wave0": true,
      "field_sources": {
        "criticality": "OBSERVED (demo_bank_app/configs/auth_gateway_tls.yaml)",
        "verification_ready_wave0": "OBSERVED (demo_bank_app/configs/auth_gateway_tls.yaml)",
        "duration_minutes": "DECLARED (demo_bank_app/services.py)",
        "rollout_cost": "DECLARED (demo_bank_app/services.py)"
      },
      "features": {
        "group_purpose_pairs": [
          [
            "RSA",
            "digital_signature"
          ],
          [
            "WEAK_HASH",
            "message_digest"
          ],
          [
            "EC",
            "key_establishment"
          ]
        ],
        "network_exposure": "observed_listener",
        "criticality": "HIGH",
        "dependents_norm": 1.0,
        "verification_ready_wave0": true
      },
      "risk": {
        "score": 11.5,
        "contributions": {
          "crypto_exposure": 6.6,
          "network_exposure": 1.5,
          "criticality": 1.4,
          "dependents": 1.5,
          "verification_readiness": 0.5
        },
        "inputs": {
          "crypto_exposure": 2.2,
          "network_exposure": 1.0,
          "criticality": 0.7,
          "dependents": 1.0,
          "verification_readiness": 1.0
        },
        "reason": "crypto_exposure=2.20x3=6.60; network_exposure=1.00x1.5=1.50; criticality=0.70x2=1.40; dependents=1.00x1.5=1.50; verification_readiness=1.00x0.5=0.50 | pairs=['EC/key_establishment', 'RSA/digital_signature', 'WEAK_HASH/message_digest'] | criticality=HIGH | exposure=observed_listener",
        "label": "PROVISIONAL, UNVALIDATED"
      }
    },
    "card_vault": {
      "service_id": "card_vault",
      "evidence_source": "OBSERVED",
      "finding_ids": [
        "YML-card_vault_crypto-01",
        "YML-card_vault_crypto-02"
      ],
      "hold_finding_ids": [],
      "files": [
        "demo_bank_app/configs/card_vault_crypto.yaml"
      ],
      "legacy_algorithms": [
        "3DES",
        "RSA-2048"
      ],
      "candidate_targets": [
        "AES-256-GCM [symmetric_encryption]",
        "ML-KEM-768 (FIPS 203) Hybrid Key Encapsulation [key_establishment]"
      ],
      "duration_minutes": 35,
      "rollout_cost": 20.0,
      "criticality": "HIGH",
      "verification_ready_wave0": false,
      "field_sources": {
        "criticality": "OBSERVED (demo_bank_app/configs/card_vault_crypto.yaml)",
        "verification_ready_wave0": "OBSERVED (demo_bank_app/configs/card_vault_crypto.yaml)",
        "duration_minutes": "DECLARED (demo_bank_app/services.py)",
        "rollout_cost": "DECLARED (demo_bank_app/services.py)"
      },
      "features": {
        "group_purpose_pairs": [
          [
            "RSA",
            "key_establishment"
          ],
          [
            "LEGACY_SYM",
            "symmetric_encryption"
          ]
        ],
        "network_exposure": "none_observed",
        "criticality": "HIGH",
        "dependents_norm": 0.0,
        "verification_ready_wave0": false
      },
      "risk": {
        "score": 5.9,
        "contributions": {
          "crypto_exposure": 4.5,
          "network_exposure": 0.0,
          "criticality": 1.4,
          "dependents": 0.0,
          "verification_readiness": 0.0
        },
        "inputs": {
          "crypto_exposure": 1.5,
          "network_exposure": 0.0,
          "criticality": 0.7,
          "dependents": 0.0,
          "verification_readiness": 0.0
        },
        "reason": "crypto_exposure=1.50x3=4.50; network_exposure=0.00x1.5=0.00; criticality=0.70x2=1.40; dependents=0.00x1.5=0.00; verification_readiness=0.00x0.5=0.00 | pairs=['LEGACY_SYM/symmetric_encryption', 'RSA/key_establishment'] | criticality=HIGH | exposure=none_observed",
        "label": "PROVISIONAL, UNVALIDATED"
      }
    },
    "interbank_tls": {
      "service_id": "interbank_tls",
      "evidence_source": "OBSERVED",
      "finding_ids": [
        "INV-0001",
        "INV-0002",
        "INV-0004",
        "INV-0005",
        "INV-0006"
      ],
      "hold_finding_ids": [],
      "files": [
        "demo_bank_app/configs/interbank_tls_nginx.conf"
      ],
      "legacy_algorithms": [
        "3DES",
        "ECDH",
        "RSA"
      ],
      "candidate_targets": [
        "Candidate: AES-256-GCM [symmetric_encryption]",
        "Candidate: ML-DSA (FIPS 204) or SLH-DSA (FIPS 205), subject to library/peer support [digital_signature]",
        "Candidate: ML-KEM (FIPS 203), e.g. ML-KEM-768 or hybrid X25519MLKEM768 in TLS 1.3 [key_establishment]"
      ],
      "duration_minutes": 40,
      "rollout_cost": 22.0,
      "criticality": "CRITICAL",
      "verification_ready_wave0": true,
      "field_sources": {
        "criticality": "DECLARED (demo_bank_app/services.py)",
        "verification_ready_wave0": "DECLARED (demo_bank_app/services.py)",
        "duration_minutes": "DECLARED (demo_bank_app/services.py)",
        "rollout_cost": "DECLARED (demo_bank_app/services.py)"
      },
      "features": {
        "group_purpose_pairs": [
          [
            "EC",
            "key_establishment"
          ],
          [
            "EC",
            "key_establishment"
          ],
          [
            "RSA",
            "key_establishment"
          ],
          [
            "LEGACY_SYM",
            "symmetric_encryption"
          ],